title,authors,publisher,subject,categories,maturityRating,page_count,average_rating,ratings_count,published_date,description,publish_year,page_count_scaled,publish_year_scaled,cluster_11,cluster_14,cluster_12,cluster_13,cluster
On the Revolutions of Heavenly Spheres,Nicolaus Copernicus,Simon and Schuster,science,Science,NOT_MATURE,573,0.0,0,2010-08-27,"The Ptolemaic system of the universe, with the earth at the center, had held sway since antiquity as authoritative in philosophy, science, and church teaching. Following his observations of the heavenly bodies, Nicolaus Copernicus (1473-1543) abandoned the geocentric system for a heliocentric model, with the sun at the center. His remarkable work, On the Revolutions of Heavenly Spheres, stands as one of the greatest intellectual revolutions of all time, and profoundly influenced, among others, Galileo and Sir Isaac Newton.",2010,0.23345817727840198,0.7866666666666653,3,3,3,3,0
Conservation Biology for All,"Navjot S. Sodhi, Paul R. Ehrlich",Oxford University Press,science,Nature,NOT_MATURE,369,4.0,1,2010-01-07,"Conservation Biology for All provides cutting-edge but basic conservation science to a global readership. A series of authoritative chapters have been written by the top names in conservation biology with the principal aim of disseminating cutting-edge conservation knowledge as widely as possible. Important topics such as balancing conversion and human needs, climate change, conservation planning, designing and analyzing conservation research, ecosystem services, endangered species management, extinctions, fire, habitat loss, and invasive species are covered. Numerous textboxes describing additional relevant material or case studies are also included. The global biodiversity crisis is now unstoppable; what can be saved in the developing world will require an educated constituency in both the developing and developed world. Habitat loss is particularly acute in developing countries, which is of special concern because it tends to be these locations where the greatest species diversity and richest centres of endemism are to be found. Sadly, developing world conservation scientists have found it difficult to access an authoritative textbook, which is particularly ironic since it is these countries where the potential benefits of knowledge application are greatest. There is now an urgent need to educate the next generation of scientists in developing countries, so that they are in a better position to protect their natural resources.",2010,0.14856429463171036,0.7866666666666653,3,13,3,3,0
Quantum Physics for Poets,Leon M. Lederman,Prometheus Books,science,Science,NOT_MATURE,338,0.0,0,2011-09-27,"In this lucid, informative book, designed for the curious, a Nobel Prize laureate and a theoretical physicist make the seemingly daunting subject of quantum physics accessible, appealing, and exciting.",2011,0.13566375364128172,0.8000000000000007,3,3,3,3,0
Reinventing The Future,Thomas A. Bass,Addison Wesley Publishing Company,science,Biography & Autobiography,NOT_MATURE,288,0.0,0,1994-01-01,"The author of The Eudaemonic Pie now reveals the inspiration, motivations, and aspirations of the world's greatest scientists. The scientists interviewed in this collection have changed the rules of the game--altered our perception of reality and the language used to describe it.",1994,0.11485642946317104,0.5733333333333341,3,13,3,3,0
Einstein's Theory of Relativity,Max Born,Courier Corporation,science,Science,NOT_MATURE,404,5.0,2,1962-01-01,A Nobel Prize-winning physicist explains the historical background and scientific principles of Einstein's famous theory,1962,0.16312942155638785,0.14666666666666472,3,3,3,3,0
Quantum Theory,David Bohm,Courier Corporation,science,Science,NOT_MATURE,673,5.0,1,1989-05-01,"This advanced undergraduate-level text presents the quantum theory in terms of qualitative and imaginative concepts, followed by specific applications worked out in mathematical detail.",1989,0.2750728256346234,0.5066666666666677,3,3,3,3,0
Political Ecology,Paul Robbins,John Wiley & Sons,science,Social Science,NOT_MATURE,306,0.0,0,2019-12-16,"An accessible, focused exploration of the field of political ecology The third edition of Political Ecology spans this sprawling field, using grounded examples and careful readings of current literature. While the study of political ecology is sometimes difficult to fathom, owing to its breadth and diversity, this resource simplifies the discussion by reducing the field down into a few core questions and arguments. These points clearly demonstrate how critical theory can make pragmatic contributions to the fields of conservation, development, and environmental management. The latest edition of this seminal work is also more closely focused, with references to recent work from around the world. Further, Political Ecology raises critical questions about “traditional” approaches to environmental questions and problems. This new edition: Includes international work in the field coming out of Europe, Latin America, and Asia Explains political ecology and its tendency to disrupt the environmental research and practice by both advancing and undermining associated fields of study Contains contributions from a wide range of diverse backgrounds and expertise Offers a resource that is written in highly-accessible, straightforward language Outlines the frontiers of the field and frames climate change and the end of population growth with the framework of political ecology An excellent resource for undergraduates and academics, the third edition of Political Ecology offers an updated edition of the guide to this diverse, quickly growing field that is at the heart of how humans shape the world and, in turn, are shaped by it.",2019,0.1223470661672909,0.9066666666666663,3,13,3,3,0
Principles of Physical Chemistry,"Hans Kuhn, Horst-Dieter Försterling, David H. Waldeck",John Wiley & Sons,science,Science,NOT_MATURE,1080,0.0,0,2009-03-17,"Principles of Physical Chemistry, Second Edition uniquely uses simple physical models as well as rigorous treatments for understanding molecular and supramolecular systems and processes. In this way the presentation assists students in developing an intuitive understanding of the subjects as well as skill in quantitative manipulations. The unifying nature of physical chemistry is emphasized in the book by its organization - beginning with atoms and molecules, and proceeding to molecular assemblies of increasing complexity, ending with the emergence of matter that carries information, i.e. the origin of life, a physicochemical process of unique importance. The aim is to show the broad scope and coherence of physical chemistry.",2009,0.4444444444444445,0.7733333333333334,3,3,3,3,0
Tsunami,Edward Bryant,CUP Archive,science,Nature,NOT_MATURE,356,0.0,0,2001-07-02,"Comprehensively describes the nature and process of tsunami, for students and researchers, and general public.",2001,0.1431543903454016,0.6666666666666679,3,13,3,3,0
Environmental Oceanography,Tom Beer,CRC Press,science,Science,NOT_MATURE,402,0.0,0,1996-11-11,"The second edition of Environmental Oceanography is the first textbook to link the needs of the coastal oceanographer and the environmental practitioner. The ever-increasing human impact on the environment, and particularly on the coastal zone, has led governments to carefully examine the environmental implications of development proposals. This book provides the background needed to undertake coastal oceanographic investigations and sets them in context by incorporating case studies and sample problems based on the author's experience as an environmental consultant.",1996,0.16229712858926343,0.5999999999999979,3,3,3,3,0
Writing Science,Joshua Schimel,OUP USA,science,Language Arts & Disciplines,NOT_MATURE,237,0.0,0,2012-01-26,"This book takes an integrated approach, using the principles of story structure to discuss every aspect of successful science writing, from the overall structure of a paper or proposal to individual sections, paragraphs, sentences, and words. It begins by building core arguments, analyzing why some stories are engaging and memorable while others are quickly forgotten, and proceeds to the elements of story structure, showing how the structures scientists and researchers use in papers and proposals fit into classical models. The book targets the internal structure of a paper, explaining how to write clear and professional sections, paragraphs, and sentences in a way that is clear and compelling.",2012,0.09363295880149813,0.8133333333333326,3,13,3,3,0
Flu,Gina Bari Kolata,Macmillan,science,Medical,NOT_MATURE,367,0.0,0,1999-01-01,"""Scientists have recently discovered shards of the flu virus in human remains frozen in the Arctic tundra and in scraps of tissue preserved in a government warehouse. In Flu, Gina Kolata, reporter for The New York Times, unravels the mystery of this lethal virus with the high drama of a great adventure story. From Alaska to Norway, from the streets of Hong Kong to the corridors of the White House, Kolata tracks the race to recover the live pathogen and probes the fear that has impelled government policy. She delves into the history of the flu and previous epidemics, profiles the experts hot on the trail and the amateurs woefully misguided, and details the science and the latest understanding of this mortal disease.""--BOOK JACKET.Title Summary field provided by Blackwell North America, Inc. All Rights Reserved",1999,0.14773200166458594,0.6400000000000006,3,13,3,3,0
Astronomy,Michael Zeilik,HarperCollins Publishers,science,Science,NOT_MATURE,552,0.0,0,1976-01-01,The ninth edition of this successful textbook describes the full range of the astronomical universe and how astronomers think about the cosmos.,1976,0.2247191011235955,0.33333333333333215,3,3,3,3,0
Science for All Americans,"Floyd James Rutherford, Andrew Ahlgren","Oxford University Press, USA",science,Language Arts & Disciplines,NOT_MATURE,276,0.0,0,1990-01-01,"In order to compete in the modern world, any society today must rank education in science, mathematics, and technology as one of its highest priorities. It's a sad but true fact, however, that most Americans are not scientifically literate. International studies of educational performance reveal that U.S. students consistently rank near the bottom in science and mathematics. The latest study of the National Assessment of Educational Progress has found that despite some small gains recently, the average performance of seventeen-year-olds in 1986 remained substantially lower than it had been in 1969. As the world approaches the twenty-first century, American schools--when it comes to the advancement of scientific knowledge--seem to be stuck in the Victorian age.In Science for All Americans, F. James Rutherford and Andrew Ahlgren brilliantly tackle this devastating problem. Based on Project 2061, a scientific literacy initiative sponsored by the American Association for the Advancement of Science, this wide-ranging, important volume explores what constitutes scientific literacy in a modern society; the knowledge, skills, and attitudes all students should acquire from their total school experience from kindergarten through high school; and what steps this country must take to begin reforming its system of education in science, mathematics, and technology.Science for All Americans describes the scientifically literate person as one who knows that science, mathematics, and technology are interdependent enterprises with strengths and limitations; who understands key concepts and principles of science; who recognizes both the diversity and unity of the natural world; and who uses scientific knowledge and scientific ways of thinking for personal and social purposes. Its recommendations for educational reform downplay traditional subject categories and instead highlight the connections between them. It also emphasizes ideas and thinking skills over the memorization of specialized vocabulary. For instance, basic scientific literacy means knowing that the chief function of living cells is assembling protein molecules according to the instructions coded in DNA molecules, but does not mean necessarily knowing the terms ""ribosome"" or ""deoxyribonucleic acid.""Science, mathematics, and technology will be at the center of the radical changes in the nature of human existence that will occur during the next life span; therefore, preparing today's children for tomorrow's world must entail a solid education in these areas. Science for All Americans will help pave the way for the necessary reforms in America's schools.",1990,0.10986267166042447,0.5199999999999996,3,13,3,3,0
Biopsy Diagnosis of Peripheral Neuropathy,"Juan M Bilbao, Robert E Schmidt",Springer,science,Medical,NOT_MATURE,499,0.0,0,2014-11-05,"Peripheral nerve analysis is a challenging task for pathologists, given the advent of new diagnoses and techniques of analysis and the impact of molecular genetics. This book presents a simple, logical method for constructing a differential diagnosis based on pathology and clinical presentation. It also provides advice on the selection of ancillary molecular, immunohistochemical and genetic techniques to establish a definitive diagnosis. Clear, authoritative guidance is offered on diagnosis of the full range of neuropathies with the aid of a wealth of high-quality color photomicrographs and electron micrographs. The pathologist will benefit greatly from the identification of a variety of artifacts and normal structures occasionally encountered in nerve biopsies that need to be distinguished from specific pathologic alterations. This user-friendly, practical text will be an invaluable aid in achieving the most specific diagnosis possible.",2014,0.20266333749479817,0.8399999999999999,3,13,3,3,0
The Individual and the Cosmos in Renaissance Philosophy,Ernst Cassirer,University of Chicago Press,science,Biography & Autobiography,NOT_MATURE,215,0.0,0,2010-04-01,"This provocative volume, one of the most important interpretive works on the philosophical thought of the Renaissance, has long been regarded as a classic in its field. Ernst Cassirer here examines the changes brewing in the early stages of the Renaissance, tracing the interdependence of philosophy, language, art, and science; the newfound recognition of individual consciousness; and the great thinkers of the period—from da Vinci and Galileo to Pico della Mirandola and Giordano Bruno. The Individual and the Cosmos in Renaissance Philosophy discusses the importance of fifteenth-century philosopher Nicholas Cusanus, the concepts of freedom and necessity, and the subject-object problem in Renaissance thought. “This fluent translation of a scholarly and penetrating original leaves little impression of an attempt to show that a ‘spirit of the age’ or ‘spiritual essence of the time’ unifies and expresses itself in all aspects of society or culture.”—Philosophy",2010,0.08447773616312942,0.7866666666666653,3,13,3,3,0
Georg Cantor,Joseph Warren Dauben,Princeton University Press,science,Mathematics,NOT_MATURE,422,0.0,0,1990-10-10,"One of the greatest revolutions in mathematics occurred when Georg Cantor (1845-1918) promulgated his theory of transfinite sets. This revolution is the subject of Joseph Dauben's important studythe most thorough yet writtenof the philosopher and mathematician who was once called a ""corrupter of youth"" for an innovation that is now a vital component of elementary school curricula. Set theory has been widely adopted in mathematics and philosophy, but the controversy surrounding it at the turn of the century remains of great interest. Cantor's own faith in his theory was partly theological. His religious beliefs led him to expect paradoxes in any concept of the infinite, and he always retained his belief in the utter veracity of transfinite set theory. Later in his life, he was troubled by recurring attacks of severe depression. Dauben shows that these played an integral part in his understanding and defense of set theory.",1990,0.1706200582605077,0.5199999999999996,3,13,3,3,0
Neurobiology of Brain Disorders,"Michael J. Zigmond, Joseph T. Coyle, Lewis P. Rowland",Elsevier,science,Science,NOT_MATURE,823,5.0,1,2014-12-03,"Neurobiology of Brain Disorders is the first book directed primarily at basic scientists to offer a comprehensive overview of neurological and neuropsychiatric disease. This book links basic, translational, and clinical research, covering the genetic, developmental, molecular, and cellular mechanisms underlying all major categories of brain disorders. It offers students, postdoctoral fellows, and researchers in the diverse fields of neuroscience, neurobiology, neurology, and psychiatry the tools they need to obtain a basic background in the major neurological and psychiatric diseases, and to discern connections between basic research and these relevant clinical conditions. This book addresses developmental, autoimmune, central, and peripheral neurodegeneration; infectious diseases; and diseases of higher function. The final chapters deal with broader issues, including some of the ethical concerns raised by neuroscience and a discussion of health disparities. Included in each chapter is coverage of the clinical condition, diagnosis, treatment, underlying mechanisms, relevant basic and translational research, and key unanswered questions. Written and edited by a diverse team of international experts, Neurobiology of Brain Disorders is essential reading for anyone wishing to explore the basic science underlying neurological and neuropsychiatric diseases. - Links basic, translational, and clinical research on disorders of the nervous system, creating a format for study that will accelerate disease prevention and treatment - Covers a vast array of neurological disorders, including ADHD, Down syndrome, autism, muscular dystrophy, diabetes, TBI, Parkinson, Huntington, Alzheimer, OCD, PTSD, schizophrenia, depression, and pain - Illustrated in full color - Each chapter provides in-text summary points, special feature boxes, and research questions - Provides an up-to-date synthesis of primary source material",2014,0.3374947981689555,0.8399999999999999,3,3,3,3,0
Mind Children,Hans Moravec,Harvard University Press,science,Computers,NOT_MATURE,228,5.0,1,1988-01-01,"""A dizzying display of intellect and wild imaginings by Moravec, a world-class roboticist who has himself developed clever beasts . . . Undeniably, Moravec comes across as a highly knowledgeable and creative talent--which is just what the field needs"".--Kirkus Reviews.",1988,0.08988764044943821,0.4933333333333323,3,13,3,3,0
On the Origin of Species,Charles Darwin,CreateSpace,science,Science,NOT_MATURE,272,0.0,0,2013-03-09,"On the Origin of Species Or the Preservation of Favoured Races in The Struggle for Life On the Origin of Species, published on 24 November 1859, is a work of scientific literature by Charles Darwin which is considered to be the foundation of evolutionary biology. Its full title was On the Origin of Species by Means of Natural Selection, or the Preservation of Favoured Races in the Struggle for Life. For the sixth edition of 1872, the short title was changed to The Origin of Species. Darwin's book introduced the scientific theory that populations evolve over the course of generations through a process of natural selection. It presented a body of evidence that the diversity of life arose by common descent through a branching pattern of evolution. Darwin included evidence that he had gathered on the Beagle expedition in the 1830s and his subsequent findings from research, correspondence, and experimentation. Various evolutionary ideas had already been proposed to explain new findings in biology. There was growing support for such ideas among dissident anatomists and the general public, but during the first half of the 19th century the English scientific establishment was closely tied to the Church of England, while science was part of natural theology. Ideas about the transmutation of species were controversial as they conflicted with the beliefs that species were unchanging parts of a designed hierarchy and that humans were unique, unrelated to other animals. The political and theological implications were intensely debated, but transmutation was not accepted by the scientific mainstream.",2013,0.10819808572617562,0.826666666666668,3,3,3,3,0
Harlem Crossroads,Sara Blair,Princeton University Press,science,History,NOT_MATURE,392,0.0,0,2007-09-16,"""The Harlem riot of 1935 not only signaled the end of the Harlem Renaissance; it made black America's cultural capital an icon for the challenges of American modernity. Luring photographers interested in socially conscious, journalistic and aesthetic representation, post-Renaissance Harlem helped give rise to America's full-blown image culture and its definitive genre, documentary. Arguing for Harlem as a crossroads between writers and the image, Sara Blair explores its power for canonical writers, whose work was responsive to the changing meanings and uses of photographs. She examines literary engagements with photography from the 1930s to the 1970s and beyond."" --Book Jacket.",2007,0.15813566375364127,0.7466666666666661,3,13,3,3,0
Quantum Computation and Quantum Information,"Michael A. Nielsen, Isaac L. Chuang",Cambridge University Press,science,Science,NOT_MATURE,702,0.0,0,2010-12-09,"One of the most cited books in physics of all time, Quantum Computation and Quantum Information remains the best textbook in this exciting field of science. This 10th anniversary edition includes an introduction from the authors setting the work in context. This comprehensive textbook describes such remarkable effects as fast quantum algorithms, quantum teleportation, quantum cryptography and quantum error-correction. Quantum mechanics and computer science are introduced before moving on to describe what a quantum computer is, how it can be used to solve problems faster than 'classical' computers and its real-world implementation. It concludes with an in-depth treatment of quantum information. Containing a wealth of figures and exercises, this well-known textbook is ideal for courses on the subject, and will interest beginning graduate students and researchers in physics, computer science, mathematics, and electrical engineering.",2010,0.28714107365792757,0.7866666666666653,3,3,3,3,0
Pluto Confidential,"Stephen P. Maran, Laurence A. Marschall","BenBella Books, Inc.",science,Science,NOT_MATURE,234,0.0,0,2009-08-04,"When the International Astronomical Union (IAU) adopted a new definition of a ""planet"" in August 2006, Pluto became a dwarf planet, drawing a divisive line in science and public opinions. The controversy of whether Pluto is a planet continues years later, and passion about the decision remains, pitting scientist against scientist and invoking sentiments and nostalgia from the rest of the world. With the IAU definition, the future of space objects is forever changed. Learn how this resolution came to be and what it means for astronomy, who implemented it and who is against it, and whether it's the first or millionth time the world's view of astronomy has rotated on its axis. Written by an astronomer and educator who voted for the IAU resolution—Laurence A. Marschall—and a NASA scientist who supported the opposing petition that resulted—Stephen P. Maran—Pluto Confidential leaves no perspective out and no asteroid unturned in the Pluto debate. A telescopic look inside the book: History of planetary disputes, including why Jupiter almost wasn't acknowledged What Bode's Law is and how it has influenced observations Who discovered Pluto and how it was named The Kuiper Belt and its role in what it means to be a planet Beyond Pluto and the eight distinguished planets",2009,0.09238451935081149,0.7733333333333334,3,3,3,3,0
On the Origin of Species Illustrated,Charles Darwin,Unknown,science,Unknown,NOT_MATURE,770,0.0,0,2020-09-25,"On the Origin of Species (or, more completely, On the Origin of Species by Means of Natural Selection, or the Preservation of Favoured Races in the Struggle for Life), [3] published on 24 November 1859, is a work of scientific literature by Charles Darwin which is considered to be the foundation of evolutionary biology.[4] Darwin's book introduced the scientific theory that populations evolve over the course of generations through a process of natural selection. It presented a body of evidence that the diversity of life arose by common descent through a branching pattern of evolution. Darwin included evidence that he had gathered on the Beagle expedition in the 1830s and his subsequent findings from research, correspondence, and experimentation",2020,0.31543903454015815,0.9199999999999982,3,13,3,3,0
Plan B 2.0,Lester Russell Brown,W W Norton & Company Incorporated,science,Science,NOT_MATURE,365,3.0,1,2006-01-01,"Provides alternative solutions to such global problems as population control, emerging water shortages, eroding soil, and global warming, outlining a detailed survival strategy for the civilization of the future. Simultaneous.",2006,0.1468997086974615,0.7333333333333343,3,3,3,3,0
