title,authors,publisher,subject,categories,maturityRating,page_count,average_rating,ratings_count,published_date,description,publish_year,page_count_scaled,publish_year_scaled,cluster_11,cluster_14,cluster_12,cluster_13,cluster
Cards on the Table,Agatha Christie,Unknown,mystery,Fiction,NOT_MATURE,228,0.0,0,1993-01-01,"Mr. Shaitana is a strange and wealthy collector of snuff boxes and other objets d'art. One evening he invites two specialists, Superintendent Battle of Scotland Yard and crime novelist Ariadne Oliver, to a dinner party to view his special collection: four people who have committed murder and gotten away with it. As they play bridge after dinner, Shaitana is daringly murdered by someone at the party. Battle sets out to solve the crime aided, of course, by the eager Mrs. Oliver who begins with psychological deductions from the bridge score cards. After many red herrings, skeletons in the cupboard and two more deaths, Battle lays his cards on the table.",1993,0.08988764044943821,0.5599999999999987,1,1,1,1,5
Crime and Punishment,Fedor Mikhailovich Dostoevskii,Unknown,mystery,Murder,NOT_MATURE,434,0.0,0,1968-01-01,"Raskolnikov commits murder. He then must deal both with the police, and his own guilty conscience. Determined to overreach his humanity and assert his untrammelled individual will, Raskolnikov, an impoverished student living in the St. Petersburg of the Tsars, commits an act of murder and theft, and sets in motion a story which, for its excruciating suspense, its atmospheric vividness, and its profundity of characterization and vision, is almost unequaled in the literatures of the world. The best known of Dostoevsky's masterpieces, Crime and Punishment can bear any amount of rereading without losin a drop of its power over our imagination.",1968,0.17561381606325427,0.22666666666666657,1,1,1,1,5
Frost Burned,Patricia Briggs,Ace,mystery,Fiction,NOT_MATURE,322,0.0,0,2014-01-28,Originally published in hardcover in 2013.,2014,0.1290054099042863,0.8399999999999999,1,1,1,1,5
Agatha Raisin and the Witch of Wyckhadden,M. C. Beaton,Macmillan,mystery,Fiction,NOT_MATURE,228,5.0,1,2000-06-15,"Sleuth Agatha Raisin, rendered half-bald by a revengeful hairdresser, travels to a British seaside town to recuperate. But her holiday is spoiled by the murder of two local witches.",2000,0.08988764044943821,0.6533333333333324,1,1,1,1,5
The Dogs of Riga,Henning Mankell,Harvill Press,mystery,Detective and mystery stories,NOT_MATURE,326,0.0,0,2001-01-01,"February, 1991. A life raft washes ashore in Skne carrying two dead men in expensive suits, shot gangland-style. Inspector Kurt Wallander and his team determine that the men were Eastern European criminals. But what appears in Sweden to be an open-and-shut case soon plunges Wallander into an alien world of police surveillance, thinly veiled threats, and life-endangering lies. When another murder is committed, Wallander must travel to Riga, Latvia, at the peak of the massive social and political upheaval that preceded the nation's independence from the Soviet Union. Struggling to catch up with the culprits he pursues in this shadowy nation, Wallander finds that he must make a choice, decide who is lying and who is telling the truth, and test his bravery.",2001,0.13066999583853517,0.6666666666666679,1,1,1,1,5
The Seventh Function of Language,Laurent Binet,Unknown,mystery,Fiction,NOT_MATURE,369,0.0,0,2017-08-01,"The suspicious death of literary critic Roland Barthes in 1980 Paris reveals the secret history of the French intelligentsia, plunging a hapless police detective into the depths of literary theory as it was documented in a famed linguist's lost manuscript.",2017,0.14856429463171036,0.879999999999999,1,1,1,1,5
The Curious Incident of the Dog in the Night-time,Mark Haddon,Vintage,mystery,Fiction,NOT_MATURE,288,4.5,5,2003-01-01,"YA. Murder mystery. Despite his overwhelming fear of interacting with people, Christopher, a mathematically-gifted, autistic fifteen-year-old boy, decides to investigate the murder of a neighbour's dog and uncovers secret information about his mother. Whitbread book of the year 2003. WAYRBA list 2005.",2003,0.11485642946317104,0.6933333333333316,1,1,1,1,5
Funeral in Blue,Anne Perry,Fawcett,mystery,Fiction,NOT_MATURE,355,0.0,0,2002-01-01,"When two women, one of them the wife of the accused killer, are found strangled in the studio of a London artist, William Monk, his wife Hester, and Lady Callandra Daviot set out to clear their friend's name.",2002,0.14273824386183936,0.6799999999999997,1,1,1,1,5
The Redeemer,Jo Nesbø,Random House,mystery,Fiction,NOT_MATURE,578,0.0,0,2009-01-01,"As Christmas approaches, Detective Harry Hole investigates the murder of a Salvation Army singer, who turns out to have been shot by mistake.",2009,0.23553890969621308,0.7733333333333334,1,1,1,1,5
"Weep No More, My Lady",Mary Higgins Clark,Dell Publishing Company,mystery,Fiction,NOT_MATURE,388,0.0,0,1987-01-01,"Cypress Point -- the ultimate California spa where the rich and famous pursue health and beauty in unalloyed luxury. But lovely young Elizabeth Lange is after something else: the truth about the death of her beloved sister -- a famous actress who plunged from the balcony of her Manhattan penthouse. What she finds will determine the fate of Ted Winters, the handsome business tycoon who stands accused of her murder. Against a Monterey background that sparkles with sun, money, and glamour, Elizabeth stalks shadows that darken with dread and danger... shadows that threaten to reveal the stunning truth about her sister -- and herself.",1987,0.15647107781939243,0.4800000000000004,1,1,1,1,5
The Black Tower,P. D. James,Scribner Book Company,mystery,Fiction,NOT_MATURE,282,0.0,0,1975-01-01,"Responding to an old friend's call, Commander Adam Dalgliesh travels to Toynton Grange, a convalescence home in Dorset, where he finds his friend dead and, himself weakened by a recent illness, encounters multiple murder and malicious intrigue.",1975,0.11235955056179776,0.3200000000000003,1,1,1,1,5
The Clocks,Agatha Christie,Leicester : Ulverscroft,mystery,Fiction,NOT_MATURE,416,0.0,0,1983-04-01,"Hercule Poirot, the relentless Belgian detective, investigates when a body is found in Miss Millicent Pebmarsh's sitting room with four strange clocks set at 4:13.",1983,0.1681231793591344,0.42666666666666586,1,1,1,1,5
Blood Brothers,Nora Roberts,Piatkus Books,mystery,Fiction,NOT_MATURE,321,0.0,0,2007-01-01,"In the small village of Hawkins Hollow, three best friends who share the same birthday sneak off into the woods for a sleepover the evening before turning 10. But a night of celebration turns into a night of horror as their blood brother oath unleashes a three-hundred-year-old curse.Twenty-one years later, Cal Hawkins and his friends have seen their town plagued by a week of unexplainable evil events two more times - every seven years. Quinn is a well known investigative journalist, and despite Cal's protests, she insists on delving into the mystery. But when the first signs of evil appear months early, it's not only the town Cal has to protect, but also his heart.",2007,0.1285892634207241,0.7466666666666661,1,1,1,1,5
The Tenth Justice,Brad Meltzer,William Morrow & Company,mystery,Fiction,NOT_MATURE,389,3.0,4,1997-01-01,"When Ben Addison, a new clerk for a Supreme Court justice, makes an error in judgement that leaves him open to blackmail, he turns for help to Lisa, a fellow clerk, and his housemates, who work in the State Department, a senator's office, and a Washington newspaper",1997,0.15688722430295463,0.6133333333333333,1,1,1,1,5
The Athenian Murders,"José Carlos Somoza, Sonia Soto",Farrar Straus & Giroux,mystery,Fiction,NOT_MATURE,262,0.0,0,2002-01-01,"In a dual story set in ancient Greece and modern times, the idealistic Diagoras teams up with Heracles Pontor to solve the murders of young Pluto's Academy students, and the present-day translator of the ancient text pursues what he believes to be a hidden meaning in the words of the writer. 20,000 first printing.",2002,0.10403662089055349,0.6799999999999997,1,1,1,1,5
Run River,Joan Didion,"New York : Pocket Books ; Markham, Ont. : Distributed in Canada by PaperJacks",mystery,Fiction,NOT_MATURE,278,0.0,0,1963-01-01,"Joan Didion's electrifying first novel begins with a murder on the bank of the Sacramento River--a murder that is at once an act of vengeance and a blind attempt to shore up a disintegrating marriage. Out of that act, Didion constructs a tragic and beautifully nuanced work of fiction.",1963,0.11069496462754891,0.16000000000000014,1,1,1,1,5
High Five,Janet Evanovich,"Farrar, Straus, and Giroux",mystery,Fiction,MATURE,356,0.0,0,2000-06-15,Bounty hunter Stephanie Plum and her usual cohorts search for seventy-two year old Uncle Fred who has a drawer full of photographs of body parts.,2000,0.1431543903454016,0.6533333333333324,1,1,1,1,5
The Curious Incident of the Dog in the Night-Time,"Simon Stephens, Mark Haddon",A&amp;C Black,mystery,Drama,NOT_MATURE,111,4.0,1,2012-09-24,"Christopher, stands beside Mrs Shears's dead dog. It has been speared with a garden fork, it is seven minutes after midnight, and Christopher is under suspicion. He records each fact in the book he is writing to solve the mystery of who murdered Wellington.",2012,0.04119850187265918,0.8133333333333326,1,1,1,1,5
Murder on the Orient Express,Agatha Christie,Unknown,mystery,Detective and mystery stories,NOT_MATURE,264,0.0,0,1968-01-01,"Hercule Poirot observed his fellow passengers on the Orient Express: a Russian princess, an English colonel, an American with a strange glint in his eye and many more. He was looking forward to the journey. But is was not to be. After a restless night, he awoke to find that tragedy had struck.",1968,0.10486891385767791,0.22666666666666657,1,1,1,1,5
Still Waters,Tami Hoag,Bantam,mystery,Fiction,NOT_MATURE,449,0.0,0,1992-01-01,"Thought to be a golddigger by her less-than-cordial neighbors, Still Creek newcomer Elizabeth Stuart finds her reputation further tarnished when a murdered body falls at her feet",1992,0.18185601331668746,0.5466666666666669,1,1,1,1,5
Busy Body,M. C. Beaton,St. Martin's Press,mystery,Fiction,NOT_MATURE,308,0.0,0,2011-10-04,"A Grinch-like health and safety inspector gets his comeuppance in this irresistible new Agatha Raisin mystery from the ""New York Times""-bestselling reigning queen of cozies (""Booklist"").",2011,0.12317935913441531,0.8000000000000007,1,1,1,1,5
"""A"" is for Alibi",Sue Grafton,Crimeline,mystery,Fiction,NOT_MATURE,238,0.0,0,1987-01-01,A woman wrongly convicted of murdering her husband hires private detective Kinsey Millhone to find the real killer.,1987,0.09404910528506034,0.4800000000000004,1,1,1,1,5
Milk and Honey,Faye Kellerman,Harper Collins,mystery,Fiction,NOT_MATURE,456,3.0,1,2002-12-31,"In the silent pre-dawn city hours -- alone with his thoughts about Rina Lazarus, the woman he loves, three thousand miles away in New York -- LAPD detective Peter Decker finds a small child, abandoned and covered in blood that is not hers. It is a sobering discovery, and a perplexing one, for nobody in the development where she was found steps forward to claim the little girl. Obsessed more deeply by this case than he imagined possible, Decker is determined to follow the scant clues to an answer. But his trail is leading him to a killing ground where four bodies lie still and lifeless. And by the time Rina returns, Peter Decker is already held fast in a sticky mass of hatred, passion, and murder -- in a world where intense sweetness is accompanied by a deadly sting.",2002,0.18476903870162298,0.6799999999999997,1,1,1,1,5
Angels and Demons,Dan Brown,Random House,mystery,Fiction,NOT_MATURE,536,0.0,0,2005-01-01,"Angels and demons is a breathtakingly brilliant thriller which catapults the reader through the antiquity of Rome, through sealed crypts, dangerous catacombs, deserted cathedrals and even the most secret vault on earth.",2005,0.21806075738660008,0.7199999999999989,1,1,1,1,5
Hollywood Nocturnes,James Ellroy,Scribner,mystery,Fiction,NOT_MATURE,248,0.0,0,1994-01-01,"Dig it. A famous musician-cum-draft dodger is plotting the perfect celebrity snatch- his own. An ex-con raging on revenge in High Darktown becomes a cop's worst nightmare. While chasing kidnappers, two cops stumble on an okie town as bloody as the O.K. Corral. A strongarm for Howard Hughes and mobster Mickey Cohen finds himself playing both ends against the middle, all for a murderously magnificent moll. This is L.A., Ellroy style- corrupt cops, goons with guns, rattling roadsters- and all in the staccato rhythm of the streets. ""Hollywood Nocturnes"" shows us the seedy side of glamorous Hollywood, laid out like a corpse in the morgue.",1994,0.09821057012068249,0.5733333333333341,1,1,1,1,5
The Watersplash,Patricia Wentworth,Grand Central Pub,mystery,Fiction,NOT_MATURE,256,0.0,0,1992-03-01,,1992,0.1015397419891802,0.5466666666666669,1,1,1,1,5
Eight Million Ways to Die,Lawrence Block,Jove Books,mystery,Fiction,MATURE,308,0.0,0,1984-01-01,"Nobody knows better than Matthew Scudder how far down a person can sink in this city. A young prostitute named Kim knew it also -- and she wanted out. Maybe Kim didn't deserve the life fate had dealt her. She surely didn't deserve her death. The alcoholic ex-cop turned p.i. was supposed to protect her, but someone slashed her to ribbons on a crumbling New York City waterfront pier. Now finding Kim's killer will be Scudder's penance. But there are lethal secrets hiding in the slain hooker's past that are far dirtier than her trade. And there are many ways of dying in this cruel and dangerous town -- some quick and brutal ... and some agonizingly slow.",1984,0.12317935913441531,0.4400000000000013,1,1,1,1,5
The Tightrope Walker,Dorothy Gilman,Fawcett,mystery,Fiction,NOT_MATURE,228,0.0,0,1980-01-01,"""A superb book.""THE HOUSTON CHRONICLEWhen quiet, shy Amelia Jones reads a desperate message that has fallen out of a barrel organ in the antique shop she just bought, she can't forget the words, ""They're going to kill me soon..."" Armed only with the woman's first name and the note written years before, Amelia begins a journey into the past, a search that takes her from the protective cocoon she's wrapped herself in to a precarious world where nothing is the way it seems, where fear is second nature, and dark secrets just might uncover murder--her own.... Copyright © Libri GmbH. All rights reserved.",1980,0.08988764044943821,0.3866666666666667,1,1,1,1,5
A Thief of Time,Tony Hillerman,Unknown,mystery,Anthropology,NOT_MATURE,363,0.0,0,1991-06-01,"Kriminalroman. Jim Chee og en kollega fra Navajo stammepolitiet arbejder på hver sin sag, som knyttes sammen af et mord og viser sig at have forbindelse til Anasazierne, et ældgammelt indianerfolk",1991,0.14606741573033707,0.5333333333333314,1,1,1,1,5
Kiss,Ed McBain,William Morrow,mystery,Fiction,NOT_MATURE,364,0.0,0,1992-01-01,The policemen of the 87th precinct are uneasy about the threats on a woman's life.,1992,0.1464835622138993,0.5466666666666669,1,1,1,1,5
The Somnambulist,Jonathan Barnes,Orion,mystery,Fiction,NOT_MATURE,294,4.0,1,2007-01-01,"'Be warned. This book has no literary merit whatsoever. It is a lurid piece of nonsense, convoluted, implausible, peopled by unconvincing characters, written in drearily pedestrian prose, frequently ridiculous and wilfully bizarre. Needless to say, I doubt you'll believe a word of it.' So starts the extraordinary tale of Edward Moon, detective, his silent sidekick the Sonambulist and devilish plot to recreate the apocalyptic prophecies of William Blake and bring the British Empire crashing down. With a gallery of vividly grotesque characters, a richly evoked setting and a playful highly literate style this is an amazingly readable literary fantasy and a brilliant debut.",2007,0.11735330836454433,0.7466666666666661,1,1,1,1,5
The River King,Alice Hoffman,Unknown,mystery,Large print books,NOT_MATURE,464,0.0,0,2002-01-01,,2002,0.1880982105701207,0.6799999999999997,1,1,1,1,5
Fatal Voyage,Kathy Reichs,Vintage,mystery,Aircraft accidents,NOT_MATURE,363,0.0,0,2001-01-01,"When a plane crashes high in the mountains of North Carolina, Tempe Brennan is one of the first on the scene. As a forensic anthropologist for the state, she serves on the region's disaster response team. The task that confronts her is a sad and sickening one. Putting normal life on hold, she and her colleagues must painstakingly identify the victims. A chance discovery concerns her: a severed foot, well away from the main crash site. A deserted house close by is buried so deep in the woods that locals claim to know nothing of its existence. And her examination of the foot throws up more questions than it answers. Before she can make any progress, an anonymous accusation is levelled against her. Tempe must fight to save her professional standing. But she fears that, air tragedy aside, another corpse lies somewhere in the woods. Pitting herself against a conspiracy of silence, Tempe is determined to bring justice for her mystery victim.",2001,0.14606741573033707,0.6666666666666679,1,1,1,1,5
Where Are You Now?,Mary Higgins Clark,Simon and Schuster,mystery,Fiction,NOT_MATURE,369,0.0,0,2009-03-24,"As Carolyn MacKenzie unravels the mystery behind her brother's disappearance ten years ago, she confronts someone close to her that is equally determined to keep his whereabouts secret at any cost.",2009,0.14856429463171036,0.7733333333333334,1,1,1,1,5
The House at Riverton,Kate Morton,Pan Macmillan,mystery,Fiction,NOT_MATURE,612,0.0,0,2007-01-01,"This gorgeous debut novel is set in England between the two World Wars. The story of an aristocratic family, a mysterious death, and a vanishing way of life is told in flashback by a woman who witnessed it all and kept secrets for more than 50 years.",2007,0.24968789013732834,0.7466666666666661,1,1,1,1,5
London Match,Len Deighton,Unknown,mystery,Fiction,NOT_MATURE,452,4.0,1,1993-01-01,"""Taut...Splendid...First rate."" THE WALL STREET JOURNAL With treason epidemic in London Central, a cloud of suspicion passes over each senior agent, and each falls helplessly into Moscow Centre's brilliant, complex trap. As LONDON MATCH rushes toward its amazing climax, the ultimate, decisive confrontation is about to take place--between Samson and the British KGB agent who, from the very beginning, has held Samson's entire life in delicate balance.",1993,0.1831044527673741,0.5599999999999987,1,1,1,1,5
The Truth is Out There,"Brian Lowry, Chris Carter",Unknown,mystery,Fiction,NOT_MATURE,292,0.0,0,1995-01-01,"Pour en savoir plus sur la série culte des années 90, pour avoir accès à des informations confidentielles diffusées nulle part ailleurs, plongez-vous dans le seul guide officiel de la série. Vous y découvrirez : - le résumé complet des enquêtes de Fox Mulder et Dana Scully, agents du FBI en charge des affaires non classées; - des photos inédites; - de précieux renseignements sur les conditions de tournage et la réalisation des effets spéciaux; - des interviews exclusives du créateur de la série, Chris Carter, des deux héros, Gillian Anderson et David Duchovny; - une étude approfondie des personnages de Mulder et Scully, etc. Phénomènes paranormaux, ovnis, vampires réincarnés, petits hommes verts, manipulations génétiques, laissez-vous séduire par ces enquêtes au savoir-faire subtil, où le vraisemblable n'est jamais sûr et l'invraisemblable une évidence ...",1995,0.1165210153974199,0.586666666666666,1,1,1,1,5
Crooked House,Agatha Christie,Collins,mystery,Unknown,NOT_MATURE,188,0.0,0,1995-01-01,"Shakespeare Survey is a yearbook of Shakespeare studies and production. Since 1948 Survey has published the best international scholarship in English and many of its essays have become classics of Shakespeare criticism. Each volume is devoted to a theme, or play, or group of plays; each also contains a section of reviews of the previous year's textual and critical studies and of major British performances. The books are illustrated with a variety of Shakespearean images and production photographs. The current editor of Survey is Peter Holland. The first eighteen volumes were edited by Allardyce Nicoll, numbers 19-33 by Kenneth Muir and numbers 34-52 by Stanley Wells. The virtues of accessible scholarship and a keen interest in performance, from Shakespeare's time to our own, have characterized the journal from the start. For the first time, numbers 1-50 are being reissued in paperback, available separately and as a set.",1995,0.07324178110694965,0.586666666666666,1,1,1,1,5
Blue Shoes and Happiness,Alexander McCall Smith,A.A. Knopf,mystery,Botswana,NOT_MATURE,240,0.0,0,2006-01-01,"Precious Ramotswe must deal with a cobra in her office, information that a local medical clinic is recording faulty blood pressure readings, and the rather curt advice of Botswana's newest advice columnist. Meanwhile, Precious' assistant begins to wonder if her fianc is having second thoughts about their engagement.",2006,0.09488139825218478,0.7333333333333343,1,1,1,1,5
Cat Among the Pigeons,Agatha Christie,Unknown,mystery,Boarding schools,NOT_MATURE,224,0.0,0,1994-01-01,"Another term has begun at Meadowbank, a prestigious, well-respected British girls' school. The indomitable headmistress is preparing to retire and name her successor. There is a disconcertingly mature Middle Eastern princess among the students and several new staff members in residence. And a brand-new sports pavilion is the pride of the campus.",1994,0.08822305451518936,0.5733333333333341,1,1,1,1,5
4.50 from Paddington ; They Do it with Mirrors,Agatha Christie,Unknown,mystery,Detective and mystery stories,NOT_MATURE,473,0.0,0,1957-01-01,,1957,0.1918435289221806,0.0799999999999983,1,1,1,1,5
The Mysterious Mr Quin,Agatha Christie,Unknown,mystery,Fiction,NOT_MATURE,264,0.0,0,1993-01-01,"It had been a typical New Year's Eve party, but as midnight approaches, Mr. Satterthwaite -- a keen observer of human nature -- senses that the real drama of the evening is about to unfold. He's proved right when a mysterious stranger knocks at the door.",1993,0.10486891385767791,0.5599999999999987,1,1,1,1,5
"Full Dark, No Stars",Stephen King,Center Point Pub,mystery,Fiction,NOT_MATURE,590,3.0,2,2010-01-01,"In four previously unpublished short works, a man explores his dark nature, a writer confronts a stranger, a cancer patient makes a deal with the devil, and a woman makes a horrifying discovery about her husband.",2010,0.24053266749895963,0.7866666666666653,1,1,1,1,5
Jack and Jill,James Patterson,HarperCollins UK,mystery,Fiction,NOT_MATURE,450,4.0,1,1997-01-01,An Alex Cross homicide mystery.,1997,0.1822721598002497,0.6133333333333333,1,1,1,1,5
Why Didn't They Ask Evans?,Agatha Christie,Unknown,mystery,Detective and mystery stories,NOT_MATURE,216,0.0,0,1996-01-01,"While playing golf, Bobby Jones and Dr. Thomas discover a dying man at the base of a cliff. Before he dies, the man manages to get out the words, ""Why didn't they ask Evans?""",1996,0.08489388264669165,0.5999999999999979,1,1,1,1,5
Reflex,Dick Francis,Putnam Publishing Group,mystery,Fiction,NOT_MATURE,306,1.5,2,1981-01-01,"Longtime jockey Philip Nore is no ordinary hero. But when he begins to suspect that a racetrack photographer's fatal accident was really murder, he sets out to discover the truth and trap the killer.",1981,0.1223470661672909,0.3999999999999986,1,1,1,1,5
A Case of Need,"Michael Crichton, Jeffrey Hudson",Signet Book,mystery,Fiction,NOT_MATURE,420,0.0,0,1969-01-01,"A Case of Need is Michael Crichton's award-winning debut novel, written shortly after he completed his medical internship. Set against the ever-building pressure and pace of a large Boston medical center, the tensions flare-and explode-when a surgical operation tragically ends in death, raising countless questions. Was it accidental malpractice? A violation of the Hippocratic oath? Or cold-blooded murder?",1969,0.16978776529338327,0.23999999999999844,1,1,1,1,5
Well-schooled in Murder,Elizabeth George,Bantam,mystery,Fiction,NOT_MATURE,442,0.0,0,1991-01-01,Author's style compared to P. D. James and Ruth Rendell.,1991,0.17894298793175198,0.5333333333333314,1,1,1,1,5
The Anastasia Syndrome,Mary Higgins Clark,Random House,mystery,Fiction,NOT_MATURE,290,0.0,0,1990-01-01,"Trapped in her seventeeth-century past, a brilliant writer exacts an ancient revenge in the twentieth... A child wanders, lost and alone, in the maze of New York... A lottery ticket turns up a winning combination of love and death...",1990,0.11568872243029547,0.5199999999999996,1,1,1,1,5
Wanted-- Mud Blossom,Betsy Cromer Byars,Yearling,mystery,Juvenile Fiction,NOT_MATURE,164,0.0,0,1991-01-01,"With disappearances, a possible kidnapping, and maybe even a murder or two, it's anything but a boring weekend at the Blossoms.",1991,0.06325426550145652,0.5333333333333314,1,1,1,1,5
From Potter's Field,Patricia Daniels Cornwell,Berkley,mystery,Fiction,NOT_MATURE,390,0.0,0,1996-01-01,Dr. Kay Scarpetta matches wits with a sadistic killer who infiltrates the FBI's top-secret artificial intelligence system and closes in on Scarpetta herself,1996,0.15730337078651685,0.5999999999999979,1,1,1,1,5
Contest,Matthew Reilly,Macmillan,mystery,Fiction,NOT_MATURE,452,4.5,3,2006-01-01,"From the ""New York Times"" bestselling author of ""Scarecrow"" comes an action-packed novel about a doctor and his daughter trapped in New York's Public Library by a contest with a fatal outcome. Martin's Press.",2006,0.1831044527673741,0.7333333333333343,1,1,1,1,5
Flying Finish,Dick Francis,Unknown,mystery,Fiction,NOT_MATURE,260,0.0,0,1984-02-03,A thriller about jumping horses and how they are transported from one place to another around the world.,1984,0.10320432792342905,0.4400000000000013,1,1,1,1,5
