title,authors,publisher,subject,categories,maturityRating,page_count,average_rating,ratings_count,published_date,description,publish_year,page_count_scaled,publish_year_scaled,cluster_11,cluster_14,cluster_12,cluster_13,cluster
Malafrena,Ursula K. Le Guin,Penguin Adult Hc/Tr,romance,Fiction,NOT_MATURE,380,3.0,1,1979-01-01,"""When the fiery, idealistic Itale is sent away to school, he quickly falls under the sway of an underground revolutionary movement sworn to destroy Austria's domination of Orsinia. Itale is prepared to die for his country's independence and refuses to return home ot the complacent life of a wealthy landowner.""--Dust jacket flap.",1979,0.15314190595089472,0.3733333333333313,10,10,10,10,3
Above and Beyond,Sandra Brown,Mira Books,romance,Fiction,NOT_MATURE,297,0.0,0,1986-01-01,Trevor's love for Kyla--the widow of his best friend--is complicated by a secret that threatens to destroy their fragile relationship,1986,0.11860174781523097,0.466666666666665,10,10,10,10,3
Because of Low,Abbi Glines,Simon and Schuster,romance,Fiction,NOT_MATURE,320,0.0,0,2013-07-02,"Originally self-published as an e-book, 2012.",2013,0.12817311693716188,0.826666666666668,10,10,10,10,3
Up in Flames,Abbi Glines,Simon and Schuster,romance,Fiction,NOT_MATURE,256,0.0,0,2016-06-28,"""The villain of Rosemary Beach finally gets her own happy ending in the long-awaited final novel of the #1 New York Times bestselling new adult romance series by Abbi Glines""--",2016,0.1015397419891802,0.8666666666666671,10,10,10,10,3
Layla,Colleen Hoover,Montlake Romance,romance,Fiction,NOT_MATURE,304,5.0,2,2020-12-08,"""When Leeds meets Layla, he's convinced he'll spend the rest of his life with her--until an unexpected attack leaves Layla fighting for her life. After weeks in the hospital, Layla recovers physically, but the emotional and mental scarring has altered the woman Leeds fell in love with. In order to put their relationship back on track, Leeds whisks Layla away to the bed-and-breakfast where they first met. Once they arrive, Layla's behavior takes a bizarre turn. And that's just one of many inexplicable occurrences.""--",2020,0.12151477320016647,0.9199999999999982,10,10,10,10,3
Daughter of the Forest,Juliet Marillier,Macmillan,romance,Fiction,NOT_MATURE,442,4.5,8,2000-01-01,"To reclaim the lives of her brothers, Sorcha leaves the only safe place she has known and starts on a journey of pain, loss, and terror.",2000,0.17894298793175198,0.6533333333333324,10,10,10,10,3
It's Not Summer Without You,Jenny Han,Penguin UK,romance,Juvenile Fiction,NOT_MATURE,207,0.0,0,2011-05-05,"One girl. Two brothers. Which one will she choose? Isabel's lazy, long hot summers at her family friends' beach house are over. Conrad - sexy and unavailable - is the only boy she's ever loved. He's left for college, taking her heart with him. Jeremiah, his gorgeous brother, is still Isabel's best friend - but maybe friendship isn't enough for him anymore . . . Isabel just wants everything to stay the same, because change means moving on. But if she stops looking back, will she find a future she never knew she wanted?",2011,0.08114856429463171,0.8000000000000007,10,10,10,10,3
Never Say Die,Tess Gerritsen,MIRA,romance,Fiction,NOT_MATURE,260,0.0,0,1996-01-01,"Never Say Die by Tess Gerritsen released on Oct 25, 1996 is available now for purchase.",1996,0.10320432792342905,0.5999999999999979,10,10,10,10,3
Prince Charming,Julie Garwood,Simon and Schuster,romance,Fiction,NOT_MATURE,564,5.0,1,1995-02-01,"Beautiful Taylor Baker, whose fiance has eloped with her odious cousin and whose greedy uncle has his own plans for her, escapes to Montana with rough-edged American Lucas Ross.",1995,0.22971285892634208,0.586666666666666,10,10,10,10,3
Last Voyage of the Valentina,Santa Montefiore,Simon and Schuster,romance,Fiction,NOT_MATURE,416,0.0,0,2006-06-06,"When Alba discovers a portrait of her deceased mother, she travels to the Amalfi coast of Italy to find out about her mother's past and not only discovers hidden secrets, but realizes the possibility of love and happiness in her own future.",2006,0.1681231793591344,0.7333333333333343,10,10,10,10,3
Simple Gifts,"Judith McNaught, Jude Deveraux",Simon and Schuster,romance,Fiction,NOT_MATURE,404,0.0,0,2001-12-01,4 Heartwarming Christmas Stories.,2001,0.16312942155638785,0.6666666666666679,10,10,10,10,3
The Summer Hideaway,Susan Wiggs,Harlequin,romance,Fiction,NOT_MATURE,425,0.0,0,2010-02-23,"Beloved, bestselling author Wiggs delivers the next installment of her popular Lakeshore Chronicles series--a touching tale of secrets and sacrifice, loss and redemption . . . and a love too powerful to be denied. Original.",2010,0.17186849771119433,0.7866666666666653,10,10,10,10,3
The Bachelor List,Jane Feather,Random House of Canada,romance,Fiction,NOT_MATURE,343,0.0,0,2004-01-01,"The eldest of three sisters who run a discreet matchmaking service in Edwardian London, Constance Duncan finds herself falling for Max Ensor, an exasperating politician whose old-fashioned attitudes infuriate Constance.",2004,0.13774448605909279,0.706666666666667,10,10,10,10,3
Northern Lights,Nora Roberts,Piatkus Books,romance,Fiction,NOT_MATURE,580,0.0,0,2004-01-01,"Lunacy, Alaska - population 506 - is Nate Burke's last chance. As a Baltimore cop, he had watched his partner die - and the guilt still haunts him. Maybe serving as Chief of Police in this tiny, remote town, where darkness falls by mid-afternoon and temperatures fall to below zero, will bring some kind of solace. It isn't as if he has anywhere else to go. Aside from sorting out a run-in between a couple of motor vehicles and a moose and pulling apart two brothers fighting overJohn Wayne's best movie Nate's first weeks on the job are relatively quiet. But as he wonders whether this was all a big mistake, an unexpected kiss from feisty bush pilot Meg Galloway under the brilliant Northern Lights of the Alaska sky lifts his spirit - and convinces him to stay just a little longer. Born and raised in Lunacy, Meg has learned to be independent. But there's something about Nate's sad eyes that gets under her skin, and warms her frozen heart. However, when two climbers find a corpse on the mountain, Nate discovers that Lunacy isn't quite the sleepy little backwater he imagined.",2004,0.2363712026633375,0.706666666666667,10,10,10,10,3
Death of an Ancient King,Laurent Gaudé,HarperCollins Publishers,romance,Fiction,NOT_MATURE,264,0.0,0,2004-01-01,"A fable about the blindness of war, from a popular writer dubbed ""le chouchou des libraires'"" (""the darling of the booksellers"") by the French press.",2004,0.10486891385767791,0.706666666666667,10,10,10,10,3
Sometimes It Lasts,Abbi Glines,Simon and Schuster,romance,Fiction,MATURE,288,0.0,0,2014-06-03,"Enduring a long-distance relationship with the beautiful but hot-tempered Eva after landing a baseball scholarship, Cage resolves to prove his worth when he learns that Eva has been consoling herself in the arms of another man.",2014,0.11485642946317104,0.8399999999999999,10,10,10,10,3
Down the Rabbit Hole,"J. D. Robb, Mary Blayney, Elaine Fox, Mary Kay McComas, Ruth Ryan Langan",Berkley,romance,Fiction,NOT_MATURE,434,0.0,0,2015-09-29,"Inspired by the enchanting Lewis Carroll classic, a collection of stories, takes readers to a place rife with the mad, impossible, and the curiouser that is neither here nor there and where things are never quite as they seem.",2015,0.17561381606325427,0.8533333333333317,10,10,10,10,3
Play,Kylie Scott,Macmillan,romance,Fiction,MATURE,305,0.0,0,2014-08-26,"Mal Ericson, drummer for the world famous rock band Stage Dive, needs to clean up his image fast. Having a good girl on his arm should do the job just fine. He doesn't plan on this temporary fix becoming permanent. Anne Rollins never thought she'd ever meet the rock god whose posters plastered her teenage bedroom walls - especially not under these circumstances. Anne has money problems. But being paid to play the pretend girlfriend to a wild life-of-the-party drummer couldn't end well. No matter how hot he is. Or could it?",2014,0.12193091968372867,0.8399999999999999,10,10,10,10,3
A Man to Call My Own,Johanna Lindsey,Simon and Schuster,romance,Fiction,NOT_MATURE,465,0.0,0,2004-04-01,"Charismatic twins Amanda and Marlan Laton, sent to live with their aunt on a sprawling 1870s Texas ranch, find themselves competing for the love of cowboy neighbor Chad Kinkaid.",2004,0.18851435705368288,0.706666666666667,10,10,10,10,3
Monsters,Liz Kay,Penguin,romance,Fiction,NOT_MATURE,370,0.0,0,2016-01-01,"""A cracklingly funny and poignant debut novel about the ways we love, even when we're not at our best"" --",2016,0.14898044111527256,0.8666666666666671,10,10,10,10,3
In Another Man's Bed,Francis Ray,Macmillan,romance,Fiction,NOT_MATURE,356,0.0,0,2007-02-06,"Looking down at her comatose husband, who was injured in a car wreck, Justine wonders how she will choose between this man who needs her and the old flame who loves her.",2007,0.1431543903454016,0.7466666666666661,10,10,10,10,3
Special Delivery,Danielle Steel,Unknown,romance,Fiction,NOT_MATURE,226,0.0,0,1997-01-01,"Tells the story of Jack Watson, a wealthy Beverly Hills businessman and widower, who falls in love with his daughter-in-law's mother and together they discover a relationship marked by challenges and surprises.",1997,0.08905534748231378,0.6133333333333333,10,10,10,10,3
The Newlyweds,Elizabeth Bevarly,Silhouette Books,romance,Fiction,NOT_MATURE,260,0.0,0,2005-01-01,"In FBI agent Bridget Logan's latest assignment, she must masquerade as a newlywed with sexy agent Samuel Jones. And for the first time in her career, Bridget has trouble keeping a cool head under fire. Original.",2005,0.10320432792342905,0.7199999999999989,10,10,10,10,3
Sons and Lovers,David Herbert Lawrence,Penguin Group,romance,Fiction,NOT_MATURE,650,0.0,0,1977-01-01,A provocative portrait of an artist torn between love for his possessive mother and desire for two young beautiful women. It is also the story of Paul Morel's growing into manhood torn by both inner and outer conflict.,1977,0.26550145651269247,0.34666666666666757,10,10,10,10,3
Odd Girl Out,Ann Bannon,Unknown,romance,Fiction,NOT_MATURE,194,0.0,0,2016-08-08,"2016 Reprint of 1957 Edition. Full facsimile of the original edition, not reproduced with Optical Recognition Software. Bannon is one of only a very few women who have written about being lesbian during the 1950s and 1960s. Her novels, all issued as paperbacks with ongoing characters, reflect the repressiveness of those decades and reveal how much needed to change. Bannon presents all the constraints that gays endured in the 1950's; the fear of sharing one's personal life one's coworkers, friends or even family because if could mean losing everything; and if the police were called, there was always the risk of jail. Laura Landon is a sheltered freshman at a fictional university in a Midwestern town. Intensely shy and introverted, she is drawn to the president of the Student Union, Beth Cullison. Beth is outgoing and friendly, experienced socially (with men, particularly) but feels a void in her life. She doesn't understand how the other girls are so fulfilled by the men in their lives, despite having tried. Every time she allows herself to be intimate with one, she breaks it off out of disappointment.",2016,0.07573866000832294,0.8666666666666671,10,10,10,10,3
The Pacific and Other Stories,Mark Helprin,Penguin Press HC,romance,Fiction,NOT_MATURE,392,0.0,0,2004-01-01,"In 1972, a female reservist in the Israeli army, who has despaired of love, finds it at the very last minute and in its finest expression, while floating in the sea off Haifa.""--BOOK JACKET.",2004,0.15813566375364127,0.706666666666667,10,10,10,10,3
Princess Daisy,Judith Krantz,Random House Value Publishing,romance,Fiction,MATURE,496,0.0,0,1980-01-01,"She was born Princess Marguerite Alexandrovna Valensky. But everyone called her Daisy. She was a blonde beauty living in a world of aristocrats and countless wealthy. Her father was a prince, a Russian nobleman. Her mother was an American movie goddess. Men desired her. Women envied her. Daisy's life was a fairy tale filled with parties and balls, priceless jewels, money and love. Then, suddenly, the fairy tale ended. And Princess Daisy had to start again, with nothing--except the secret she guarded from the day she was born. ""From the Paperback edition.""",1980,0.20141489804411153,0.3866666666666667,10,10,10,10,3
Eden Close,Anita Shreve,Abacus Software,romance,Blindness,NOT_MATURE,288,0.0,0,1994-01-01,"Andrew, an advertising executive in his mid-30s, returns to his hometown in upstate New York for his mother's funeral. He does not intend to stay in the slow rural backwater he left seventeen years before. But the dreams and memories persist and in the darkened farmhouse he relives that hot, bloody night when Eden Close was blinded -- by the same gun that killed her father. The enigmatic Eden had been Andrew's childhood companion. Together the two roamed summer cornfields, smoked their first forbidden cigarettes, skated, fished and fought until the tomboy turned temptress -- then their friendship ended. Now, despite warnings, Andrew is drawn again to this lost, blind girl of his youth, drawn to save her from the cruel neglect she has endured for seventeen sightless years without him. But first he must discover the grisly truth about that night . . .",1994,0.11485642946317104,0.5733333333333341,10,10,10,10,3
Emma,Jane Austen,Signet Classics,romance,Fiction,NOT_MATURE,422,0.0,0,1996-01-01,"Each of these four crocheted afghans by Sandy Rideout has its own fun details that kids will love, such as dimensional wings or a lacy pattern in the edging. There are black-and-yellow bumble bees buzzing on a red throw, sweet lady bugs marching on a white and green afghan, multicolored butterflies on a black throw with variegated borders and edging, and a dragonfly blanket that is lovely in shades of lavender and blue.",1996,0.1706200582605077,0.5999999999999979,10,10,10,10,3
If Not for You,Debbie Macomber,Unknown,romance,Fiction,NOT_MATURE,386,0.0,0,2017-01-01,"Moving away from her oppressive parents in the hopes of taking charge of her own life, Beth takes a job as a school music teacher and initially resists her attraction to a tattooed mechanic who is the epitome of everything her conservative parents fear.",2017,0.155638784852268,0.879999999999999,10,10,10,10,3
Thus Bad Begins,Javier Marías,Knopf,romance,Fiction,NOT_MATURE,465,0.0,0,2016-01-01,"**Named a Best Book of the Year by the Boston Globe and Los Angeles Times** From the internationally acclaimed author of The Infatuations comes the mesmerizing story of a couple living in the shadow of a mysterious, unhappy history--a novel about the cruel, tender punishments we exact on those we love. Madrid, 1980. Juan de Vere, nearly finished with his university degree, takes a job as personal assistant to Eduardo Muriel, an eccentric, once-successful film director. Urbane, discreet, irreproachable, Muriel is an irresistible idol to the young man. But Muriel's voluptuous wife, Beatriz, inhabits their home like an unwanted ghost; and on the periphery of their lives is Dr. Jorge Van Vechten, a family friend implicated in unsavory rumors that Muriel now asks Juan to investigate. As Juan draws closer to the truth, he uncovers only more questions. What is at the root of Muriel's hostility toward his wife? How did Beatriz meet Van Vechten? What happened during the war? Marías leads us deep into the intrigues of these characters, through a daring exploration of rancor, suspicion, loyalty, trust, and the infinitely permeable boundaries between the deceptions perpetrated on us by others and those we inflict upon ourselves.",2016,0.18851435705368288,0.8666666666666671,10,10,10,10,3
"To Sir Phillip, with Love",Julia Quinn,Unknown,romance,Fiction,NOT_MATURE,274,0.0,0,2003-01-01,She wrote him a letter and he stole her heart.,2003,0.10903037869330005,0.6933333333333316,10,10,10,10,3
Just for Now,Abbi Glines,Simon and Schuster,romance,Juvenile Fiction,NOT_MATURE,337,0.0,0,2013-08-27,Amanda's infatuation with bad boy Preston knows no limits.,2013,0.13524760715771952,0.826666666666668,10,10,10,10,3
The Play,Elle Kennedy,Unknown,romance,College students,NOT_MATURE,422,0.0,0,2019-10-07,A brand-new standalone novel in the New York Times bestselling Briar U series by Elle Kennedy.,2019,0.1706200582605077,0.9066666666666663,10,10,10,10,3
The Girl from Summer Hill,Jude Deveraux,Ballantine Books,romance,Fiction,NOT_MATURE,385,5.0,1,2016-01-01,"The first novel of New York Times bestselling author Jude Deveraux's breathtaking series set in Summer Hill, a small town where love takes centre stage against the backdrop of Jane Austen's Pride and Prejudice. Enter Elizabeth Bennet. Chef Casey Reddick has had it up to here with men. Arriving in the charming town of Summer Hill, Virginia, peace and quiet on the picturesque Tattwell plantation is just what she needs. But the tranquillity is broken one morning when she sees a gorgeous naked man on her porch. Enter Mr. Darcy. What Tate Landers, Hollywood heartthrob and owner of Tattwell, doesn't need on a bittersweet trip to his ancestral home is a woman spying on him. His anger, which looks so good on the screen, makes a bad first impression on Casey - and she lets him know it",2016,0.15522263836870578,0.8666666666666671,10,10,10,10,3
Sunny Chandler's Return,Sandra Brown,Bantam,romance,Fiction,NOT_MATURE,232,0.0,0,2004-01-01,"Sandra Brown has won over fans and critics throughout the world with more than fifty New York Times bestselling novels. Her early works were hailed by Rendezvous magazine as stories with ""larger than life heroes and heroines [who] make you believe all the warm, wonderful, wild things in life."" Here is the unforgettable story of a woman who returns to her small hometown in the South--and finds that the sins of her past are right where she left them. Never. Sunny Chandler always said she'd never go back to the tiny town where she grew up. It was just three years ago that she was at the center of a notorious scandal--and the good folks of Latham Green, Louisiana, made it clear they'd never let her forget it. So Sunny packed up and headed for New Orleans, and now she wouldn't give up city life for the world. But when she's invited to her best friend's wedding, Sunny has no choice but to go home. And with her return come the whispers...the looks...the rumors she tried to escape. It doesn't take Sunny long to see that Latham Green has nothing new to offer. Except maybe Ty Beaumont. The moment Ty and Sunny first meet at a party, he can see she's no ordinary woman. With her dazzling hair, and eyes the color of gold, she's a flesh-and-blood fantasy--and Ty vows he'll have her in his bed before the week is out. Yet even when he turns on his southern charm, Sunny makes it clear she's not interested. Sure, a night with Ty would be wilder than Bourbon Street at Mardi Gras. But Sunny's not in town to become some good ol' boy's latest conquest, no matter how sexy he is. Little does she know that Ty isn'tused to taking no for an answer--and he isn't about to start now. Soon what began as an innocent flirtation becomes a tantalizingly slow, skillfully deliberate, and overwhelmingly seductive pursuit that even Sunny finds hard to resist. But resist him she will. For Sunny is harboring an agonizing secret--the painful truth of why she left Latham Green the way she did. What she really needs now is a friend--and that's when she discovers there may be more to Ty Beaumont than meets the eye. Despite his roguish facade, Sunny comes to see he has a heart of gold. Still, she doesn't know if she can trust another person with her secret heartbreak--not even the one man who may be able to heal it.",2004,0.09155222638368707,0.706666666666667,10,10,10,10,3
Second Chance,Danielle Steel,"Random House Digital, Inc.",romance,Fiction,NOT_MATURE,248,5.0,1,2004-01-01,"Freewheeling fashion magazine editor Fiona Monaghan meets her match--and opposite--in conservative widower John Anderson, who accompanies her to a Paris couture show and unexpectedly steals her heart, a development that prompts both to adapt their contrasting lifestyles. 900,000 first printing.",2004,0.09821057012068249,0.706666666666667,10,10,10,10,3
Impossible,Danielle Steel,Unknown,romance,Art dealers,NOT_MATURE,548,0.0,0,2005-01-01,"Brought together by their mutual interest in art, Sasha, a widowed art gallery owner with grown children, and Liam, a successful artist nine years her junior, find new meaning in their lives through their relationship with each other.",2005,0.22305451518934666,0.7199999999999989,10,10,10,10,3
Fallen Too Far,Abbi Glines,Unknown,romance,Romance fiction,NOT_MATURE,298,5.0,1,2012-12-01,"Blaire Wynn left her small farmhouse in Alabama after her mother passed away to move in with her father and his new wife in their sprawling beach house along the Florida Gulf Coast. She isn't prepared for the lifestyle change and she knows she'll never fit into this world. Then there is her sexy stepbrother, Rush, who is as spoiled as he is gorgeous. He is also getting under her skin. She knows he is anything but good for her and that he'll never be faithful to anyone.",2012,0.11901789429879318,0.8133333333333326,10,10,10,10,3
A New Hope,Robyn Carr,MIRA,romance,Fiction,NOT_MATURE,330,0.0,0,2015-06-30,"Starting over in a small town after the tragic loss of her child, florist Ginger Dysart begins working on a big family wedding before forging a friendship that evolves into something more.",2015,0.132334581772784,0.8533333333333317,10,10,10,10,3
The Last Song,Nicholas Sparks,Grand Central Pub,romance,Fiction,NOT_MATURE,390,0.0,0,2009-09-08,"Her teenage life turned upside-down by her parents' divorce and her father's relocation out of state, Ronnie Miller remains bitter three years later when her mother urges her to spend a summer with her father, a concert pianist who is quietly immersed in creating a work of art that will become the centerpiece of a local church. By the best-selling author of The Lucky One. Movie tie-in.",2009,0.15730337078651685,0.7733333333333334,10,10,10,10,3
Tidal,Emily Snow,Simon and Schuster,romance,Fiction,NOT_MATURE,308,0.0,0,2013-06-04,"Hollywood starlet Willow Avery is out of rehab, with only one chance left to redeem herself before she's officially on every director's crap list. At least, that's what her parents and her agent are claiming. She doesn't really give a damn if she ever makes another movie-she just wants to get on with her life, get back to her friends, and find her next escape. But Willow is broke, and whether she likes it or not, acting is the only job she knows how to do. When she accepts the lead in a new beach drama, Willow finds herself in Hawaii. And in Hawaii, she finds Cooper, the gorgeous Australian surfer who's been hired to train her for her new role. With the bluest eyes she's ever seen and the sexiest accent she's ever heard, Cooper's different from the men she's used to. He doesn't want to use her. And he refuses to let her fail. But when an old friend re-enters Willow's life-a friend whose toxic presence reminds her of the painful memories and deadly habits she's tried so hard to suppress-Willow will have to choose between the girl she was and the person she's becoming...or she may lose the man she's falling hard for.",2013,0.12317935913441531,0.826666666666668,10,10,10,10,3
The Devil who Tamed Her,Johanna Lindsey,Unknown,romance,Large type books,NOT_MATURE,483,0.0,0,2007-01-01,"Offended by an earl's daughter's rude temperament, wealthy Raphael Locke takes the young woman under his wing to prove to a friend that he can transform her into a good-natured and eligible match for a gentleman.",2007,0.19600499375780275,0.7466666666666661,10,10,10,10,3
It Happened One Summer,Tessa Bailey,Avon Books,romance,Unknown,NOT_MATURE,416,5.0,1,2021-07-13,"Tessa Bailey is back with a Schitt's Creek-inspired rom-com about a Hollywood ""It Girl"" who's cut off from her wealthy family and exiled to a small Pacific Northwest beach town... where she butts heads with a surly, sexy local who thinks she doesn't belong. Piper Bellinger is fashionable, influential, and her reputation as a wild child means the paparazzi are constantly on her heels. When too much champagne and an out-of-control rooftop party lands Piper in the slammer, her stepfather decides enough is enough. So he cuts her off, and sends Piper and her sister to learn some responsibility running their late father's dive bar... in Washington. Piper hasn't even been in Westport for five minutes when she meets big, bearded sea captain Brendan, who thinks she won't last a week outside of Beverly Hills. So what if Piper can't do math, and the idea of sleeping in a shabby apartment with bunk beds gives her hives. How bad could it really be? She's determined to show her stepfather--and the hot, grumpy local--that she's more than a pretty face. Except it's a small town and everywhere she turns, she bumps into Brendan. The fun-loving socialite and the gruff fisherman are polar opposites, but there's an undeniable attraction simmering between them. Piper doesn't want any distractions, especially feelings for a man who sails off into the sunset for weeks at a time. Yet as she reconnects with her past and begins to feel at home in Westport, Piper starts to wonder if the cold, glamorous life she knew is what she truly wants. LA is calling her name, but Brendan--and this town full of memories--may have already caught her heart.",2021,0.1681231793591344,0.9333333333333336,4,4,4,4,3
