title,authors,publisher,subject,categories,maturityRating,page_count,average_rating,ratings_count,published_date,description,publish_year,page_count_scaled,publish_year_scaled,cluster_11,cluster_14,cluster_12,cluster_13,cluster
The Dream of the Celt,Mario Vargas Llosa,Macmillan + ORM,fiction,Fiction,NOT_MATURE,455,0.0,0,2012-06-05,"This ""vast and intriguing novel"" explores the life of an Irish nationalist who exposed Britain's colonial crimes—by the Nobel Prize–winning author ( Guardian, UK). In 1916, the Irish nationalist Roger Casement was hanged by the British government for treason. Casement had dedicated his extraordinary life to improving the plight of oppressed peoples around the world—especially the native populations in the Belgian Congo and the Amazon. But when he dared to draw a parallel between the injustices he witnessed in African and American colonies and those committed by the British in Northern Ireland, he became involved in a cause that led to his imprisonment and execution. When Casement's homosexuality was revealed by his prosecutors—who drew excerpts from his personal ""black diary""—the resulting scandal tainted his image to such a degree that his pioneering human rights work was nearly forgotten to history. In The Dream of the Celt, Mario Vargas Llosa—one of Latin America's most vibrant, provocative, and necessary literary voices—brings this complex character to life as no other writer can. A masterful work, sharply translated by Edith Grossman, The Dream of the Celt tackles a controversial man whose story has long been neglected, and, in so doing, pushes at the boundaries of the historical novel.",2012,0.18435289221806075,0.8133333333333326,10,11,11,11,9
The Natural,Bernard Malamud,Macmillan,fiction,Fiction,NOT_MATURE,250,0.0,0,1952-01-01,Story of a baseball player's record-shattering career.,1952,0.09904286308780691,0.013333333333331865,10,11,11,11,9
Journey to the Center of the Earth,Jules Verne,Bantam,fiction,Fiction,NOT_MATURE,242,3.5,3,2006-04-25,"The intrepid Professor Lindenbrock embarks upon the strangest expedition of the nineteenth century: a journey down an extinct Icelandic volcano to the Earth’s very core. In his quest to penetrate the planet’s primordial secrets, the geologist—together with his quaking nephew Axel and their devoted guide, Hans—discovers an astonishing subterranean menagerie of prehistoric proportions. Verne’s imaginative tale is at once the ultimate science fiction adventure and a reflection on the perfectibility of human understanding and the psychology of the questor. As David Brin notes in his Introduction, though Verne never knew the term “science fiction,” Journey to the Centre of the Earth is “inarguably one of the wellsprings from which it all began.”",2006,0.0957136912193092,0.7333333333333343,10,11,11,11,9
Mysteries,Knut Hamsun,Penguin,fiction,Fiction,NOT_MATURE,356,4.0,3,2001-01-01,"The first complete English translation of the Nobel Prize-winner’s literary masterpiece A Penguin Classic Mysteries is the story of Johan Nilsen Nagel, a mysterious stranger who suddenly turns up in a small Norwegian town one summer—and just as suddenly disappears. Nagel is a complete outsider, a sort of modern Christ treated in a spirit of near parody. He condemns the politics and thought of the age, brings comfort to the “insulted and injured,” and gains the love of two women suggestive of the biblical Mary and Martha. But there is a sinister side of him: in his vest he carries a vial of prussic acid... The novel creates a powerful sense of Nagel's stream of thought, as he increasingly withdraws into the torture chamber of his own subconscious psyche. For more than seventy years, Penguin has been the leading publisher of classic literature in the English-speaking world. With more than 1,800 titles, Penguin Classics represents a global bookshelf of the best works throughout history and across genres and disciplines. Readers trust the series to provide authoritative texts enhanced by introductions and notes by distinguished scholars and contemporary authors, as well as up-to-date translations by award-winning translators.",2001,0.1431543903454016,0.6666666666666679,10,11,11,11,9
Cat's Cradle,Kurt Vonnegut,Dial Press Trade Paperback,fiction,Fiction,NOT_MATURE,308,4.0,147,1998-09-08,"“A free-wheeling vehicle . . . an unforgettable ride!”—The New York Times Cat’s Cradle is Kurt Vonnegut’s satirical commentary on modern man and his madness. An apocalyptic tale of this planet’s ultimate fate, it features a midget as the protagonist, a complete, original theology created by a calypso singer, and a vision of the future that is at once blackly fatalistic and hilariously funny. A book that left an indelible mark on an entire generation of readers, Cat’s Cradle is one of the twentieth century’s most important works—and Vonnegut at his very best. “[Vonnegut is] an unimitative and inimitable social satirist.”—Harper’s Magazine “Our finest black-humorist . . . We laugh in self-defense.”—Atlantic Monthly",1998,0.12317935913441531,0.6266666666666652,10,11,11,11,9
There There,Tommy Orange,Vintage,fiction,Fiction,NOT_MATURE,260,5.0,2,2018-06-05,"PULITZER PRIZE FINALIST • NATIONAL BESTSELLER • A wondrous and shattering award-winning novel that follows twelve characters from Native communities: all traveling to the Big Oakland Powwow, all connected to one another in ways they may not yet realize. A contemporary classic, this “astonishing literary debut” (Margaret Atwood, bestselling author of The Handmaid’s Tale) “places Native American voices front and center” (NPR/Fresh Air). One of The Atlantic’s Great American Novels of the Past 100 Years Among them is Jacquie Red Feather, newly sober and trying to make it back to the family she left behind. Dene Oxendene, pulling his life together after his uncle’s death and working at the powwow to honor his memory. Fourteen-year-old Orvil, coming to perform traditional dance for the very first time. They converge and collide on one fateful day at the Big Oakland Powwow and together this chorus of voices tells of the plight of the urban Native American—grappling with a complex and painful history, with an inheritance of beauty and spirituality, with communion and sacrifice and heroism A book with “so much jangling energy and brings so much news from a distinct corner of American life that it’s a revelation” (The New York Times). It is fierce, funny, suspenseful, and impossible to put down--full of poetry and rage, exploding onto the page with urgency and force. There There is at once poignant and unflinching, utterly contemporary and truly unforgettable. Don't miss Tommy Orange's new book, Wandering Stars!",2018,0.10320432792342905,0.8933333333333344,10,11,11,11,9
Taras Bulba,Nikolái V. Gogol,Ediciones AKAL,fiction,Literary Criticism,NOT_MATURE,154,0.0,0,2006-12-19,"Feroces, crueles, valientes y apasionados, los cosacos hacen temblar la estepa bajo los cascos de sus caballos. Y entre ellos se encuentra Taras Bulba, un anciano lleno aún de fuerza e inteligencia que junto a sus hijos, Ostap y Andrí, avanzará por tierras polacas con intención de vengar su fe ortodoxa burlada por los católicos. Ninguna guarnición, ciudad amurallada o iglesia podrán detenerlos, hasta que la desgracia se cierna sobre ellos y el apuesto y enamoradizo Andrí haga que su padre maldiga el día en que lo engendró. Taras Bulba, una anomalía entre la obra más conocida de Gogol, es una aventura trepidante, una sinfonía en perpetuo crescendo, en la que cada capítulo es más intenso y sorprendente que el anterior. un fresco tan afinadamente dibujado y tan vívido que resulta absolutamente intemporal.",2006,0.059092800665834375,0.7333333333333343,7,11,7,11,10
The Civilisation of the Renaissance in Italy,Jacob Burckhardt,Litres,fiction,Fiction,NOT_MATURE,975,0.0,0,2019-05-08,,2019,0.400749063670412,0.9066666666666663,10,11,11,11,9
The Virginian,Owen Wister,"Oxford University Press, USA",fiction,Fiction,NOT_MATURE,406,4.0,2,1998-01-01,"Owen Wister's classic popular romance THE VIRGINIAN (1902) had a significant influence on the Western fiction genre. This edition includes Wister's neglected essay, ""The Evolution of the Cow-Puncher"" (1895) and an introduction highlighting the social, gender, and political implications of Wister's mythic West in the context of its actual history.",1998,0.16396171452351227,0.6266666666666652,10,11,11,11,9
Cape Cod,Henry D. Thoreau,BoD – Books on Demand,fiction,Fiction,NOT_MATURE,262,0.0,0,2022-03-08,"Reprint of the original, first published in 1866.",2022,0.10403662089055349,0.9466666666666654,10,11,11,11,9
The History of the Peloponnesian War,Thucydides,Otbebookpublishing,fiction,Fiction,NOT_MATURE,738,0.0,0,2021-01-13,"The History of the Peloponnesian War (Greek: Ἱστορίαι, ""Histories"") is a historical account of the Peloponnesian War (431–404 BC), which was fought between the Peloponnesian League (led by Sparta) and the Delian League (led by Athens). It was written by Thucydides, an Athenian historian who also served as an Athenian general during the war. His account of the conflict is widely considered to be a classic and regarded as one of the earliest scholarly works of history. The History is divided into eight books.",2021,0.3021223470661673,0.9333333333333336,10,11,11,11,9
The House of the Seven Gables,Nathaniel Hawthorne,CreateSpace,fiction,Unknown,NOT_MATURE,250,0.0,0,2015-04-11,The House of the Seven Gables By Nathaniel Hawthorne,2015,0.09904286308780691,0.8533333333333317,4,4,4,4,10
The Last Girl,Danny Lopez,Oceanview Publishing,fiction,Fiction,NOT_MATURE,185,0.0,0,2017-08-01,"After being laid off from his job as a newspaper reporter in a coastal Florida town, Dexter Vega meets a wealthy retiree who hires him to find his daughter who is supposed to be attending the local college. When Vega visits his client to inform him that his daughter is in Mexico, he discovers the man has been murdered. And Vega's prints are all over the murder weapon.As the police build a case against him, Vega flies to Mexico City to locate his client's daughter, hoping she will help him find the murderer and thus clear his name. But when he finds the woman, she tells him a very different story—nothing is as it seems. Beaten by thugs and ordered to leave Mexico, Vega returns home to find himself immersed in a web of blackmail, greed, and revenge. Still pursued by the cops, but now a target of evil predators.",2017,0.071993341656263,0.879999999999999,10,11,11,11,9
The Scarlet Letter Annotated,Nathaniel Hawthorne,Unknown,fiction,Unknown,NOT_MATURE,316,0.0,0,2021-01-05,"Set in an early New England colony, the novel shows the terrible impact a single, passionate act has on the lives of three members of the community: the defiant Hester Prynne; the fiery, tortured Reverend Dimmesdale; and the obsessed, vengeful Chillingworth.",2021,0.126508531002913,0.9333333333333336,4,4,4,4,10
A Voyage to Arcturus,David Lindsay,Unknown,fiction,Fiction,NOT_MATURE,300,0.0,0,1968-01-01,"Considered by the Irish Times as ""one of the most brilliant flights of pure fancy ever recorded,"" this amazing story explores the beauty and untamed nature of a faraway world, where wild creatures crowd the fantastic landscape and demented torturers dominate victims with their bizarre mental powers.",1968,0.11985018726591762,0.22666666666666657,10,11,11,11,9
The Interestings,Meg Wolitzer,Penguin,fiction,Fiction,NOT_MATURE,482,0.0,0,2013-04-09,"Named a best book of the year by Entertainment Weekly, Time, and The Chicago Tribune, and named a notable book by The New York Times Book Review and The Washington Post “Remarkable . . . With this book [Wolitzer] has surpassed herself.”—The New York Times Book Review ""A victory . . . The Interestings secures Wolitzer's place among the best novelists of her generation. . . . She's every bit as literary as Franzen or Eugenides. But the very human moments in her work hit you harder than the big ideas. This isn't women's fiction. It's everyone's.""—Entertainment Weekly (A) From Meg Wolitzer, the New York Times–bestselling author of The Female Persuasion, a novel that has been called ""genius"" (The Chicago Tribune), “wonderful” (Vanity Fair), ""ambitious"" (San Francisco Chronicle), and a “page-turner” (Cosmopolitan). The summer that Nixon resigns, six teenagers at a summer camp for the arts become inseparable. Decades later the bond remains powerful, but so much else has changed. In The Interestings, Wolitzer follows these characters from the height of youth through middle age, as their talents, fortunes, and degrees of satisfaction diverge. The kind of creativity that is rewarded at age fifteen is not always enough to propel someone through life at age thirty; not everyone can sustain, in adulthood, what seemed so special in adolescence. Jules Jacobson, an aspiring comic actress, eventually resigns herself to a more practical occupation and lifestyle. Her friend Jonah, a gifted musician, stops playing the guitar and becomes an engineer. But Ethan and Ash, Jules’s now-married best friends, become shockingly successful—true to their initial artistic dreams, with the wealth and access that allow those dreams to keep expanding. The friendships endure and even prosper, but also underscore the differences in their fates, in what their talents have become and the shapes their lives have taken. Wide in scope, ambitious, and populated by complex characters who come together and apart in a changing New York City, The Interestings explores the meaning of talent; the nature of envy; the roles of class, art, money, and power; and how all of it can shift and tilt precipitously over the course of a friendship and a life.",2013,0.19558884727424053,0.826666666666668,10,11,11,11,9
World's End,T.C. Boyle,Penguin,fiction,Fiction,NOT_MATURE,481,0.0,0,1990-07-20,"WINNER OF THE PEN/FAULKNER AWARD • In this stunning novel, one man traces the tangled histories of three very different families—from the New York Times bestselling author of The Tortilla Curtain “Boyle has emerged as one of the most inventive and verbally exuberant writers of his generation.”—The New York Times Haunted by the burden of his family’s traitorous past, woozy with pot, cheap wine, and sex, and disturbed by a frighteningly real encounter with some family ghosts, Walter Van Brunt is about to have a collision with history. It will lead Walter to search for his lost father. And it will send the story into the past of the Hudson River Valley, from the 1960s back to the anticommunist riots of the 1940s to the late seventeenth century, where the long-hidden secrets of three families—the aristocratic Van Warts, the Native American Mohonks, and Walter’s own ancestors, the Van Brunts—will be revealed.",1990,0.1951727007906783,0.5199999999999996,10,11,11,11,9
Swann's Way,Marcel Proust,Yale University Press,fiction,Fiction,NOT_MATURE,506,0.0,0,2013-11-14,The narrator interrupts reminiscences about his childhood spent in late-nineteenth-century France to recall the affair which a friend of the family carried on with young Odette de Crecy.,2013,0.20557636287973366,0.826666666666668,10,11,11,11,9
The Fountainhead,Ayn Rand,Signet Book,fiction,Architects,NOT_MATURE,704,0.0,0,1952-01-01,"The story of a gifted architect, his struggle against conventional standards, and his violent love affair.",1952,0.287973366625052,0.013333333333331865,4,11,4,11,9
The Tragedy of King Lear,William Shakespeare,Unknown,fiction,Unknown,NOT_MATURE,124,0.0,0,2020-12-22,"King Lear is a tragedy written by William Shakespeare. It tells the tale of a king who bequeaths his power and land to two of his three daughters, after they declare their love for him in a fawning and obsequious manner. His third daughter gets nothing, because she will not flatter him as her sisters had done. When he feels he has been treated with disrespect by the two daughters who now have his wealth and power, he becomes furious to the point of madness. He eventually becomes tenderly reconciled to his third daughter, just before tragedy strikes her and then the king.",2020,0.04660840615896796,0.9199999999999982,4,4,4,4,10
The Severed Hand,Вильгельм Гауф,Litres,fiction,Fiction,NOT_MATURE,19,0.0,0,2019-04-10,,2019,0.002913025384935498,0.9066666666666663,10,11,11,11,9
Whiteout,Ken Follett,Wheeler Publishing,fiction,Fiction,NOT_MATURE,642,0.0,0,2005-01-01,"A missing canister containing a deadly virus forms the center of a storm that traps Stanley Oxenford, director of a medical research firm, and a violent trio of thugs in a remote house during a Christmas Eve blizzard.",2005,0.2621722846441948,0.7199999999999989,10,11,11,11,9
Pride and Prejudice,Jane Austen,Createspace Independent Publishing Platform,fiction,Unknown,NOT_MATURE,330,0.0,0,2017-09-29,"Elizabeth Bennet is Austen's most liberated and unambiguously appealing heroine, and Pride and Prejudice has remained over most of the past two centuries Austen's most popular novel. The story turns on the marriage prospects of the five daughters of Mr. and Mrs. Bennet: Elizabeth forms a prejudice against the proud and distant Mr. Darcy; Darcy's charming friend Charles Bingley falls in love with her sister Jane; and the handsome officer George Wickham forms attachments successively to Elizabeth and to her sister Lydia. Irvine's extensive introduction sets the novel in the context of the literary and intellectual history of the period, and deals with such crucial background issues as early-nineteenth century class relations in Britain, and female exclusion from property and power.",2017,0.132334581772784,0.879999999999999,4,4,4,4,10
Angelology,Danielle Trussoni,Anchor Canada,fiction,Fiction,NOT_MATURE,466,0.0,0,2011-03-01,"Set in the secluded world of cloistered abbeys, long-lost secrets and angelic humans, Angelology has all the makings of a blockbuster hit, combining elements of The Da Vinci Code and Kate Mosse's Labyrinth Sister Evangeline was just a young girl when her father left her at St. Rose Convent under the care of the Franciscan Sisters of Perpetual Adoration. Now a young woman, she has unexpectedly discovered a collection of letters dating back sixty years—letters that bring her deep into a closely guarded secret, to an ancient conflict between the millennium-old Society of Angelologists and the monstrously beautiful Nephilim, the descendants of angels and humans. Rich and mesmerizing, Angelology blends biblical lore, mythology and the fall of the Rebel Angels, creating a luminous, riveting tale of one young woman caught in a battle that will determine the fate of the world.",2011,0.1889305035372451,0.8000000000000007,10,11,11,11,9
Shakespeare on Love & Lust,Maurice Charney,Columbia University Press,fiction,Fiction,MATURE,248,0.0,0,2000-01-01,"In Shakespeare on Love & Lust, Maurice Charney delves deeply into Shakespeare's rhetorical and thematic development of this largest of subjects to reveal what makes his plays and poems resonate with contemporary audiences.""--BOOK JACKET.",2000,0.09821057012068249,0.6533333333333324,10,11,11,11,9
Typee Illustrated,Herman Melville,Unknown,fiction,Unknown,NOT_MATURE,406,0.0,0,2019-11-26,"Typee: A Peep at Polynesian Life is the first book by American writer Herman Melville, published first in London, then New York, in 1846. Considered a classic in travel and adventure literature, the narrative is partly based on the author's actual experiences on the island Nuku Hiva in the South Pacific Marquesas Islands in 1842, liberally supplemented with imaginative reconstruction and adaptation of material from other books. The title is from the province Tai Pi Vai. Typee was Melville's most popular work during his lifetime; it made him notorious as the ""man who lived among the cannibals""",2019,0.16396171452351227,0.9066666666666663,4,4,4,4,10
Robinson Crusoe Illustrated,Daniel Defoe,Unknown,fiction,Unknown,NOT_MATURE,360,0.0,0,2020-12-14,"Robinson Crusoe is a novel by Daniel Defoe, first published on 25 April 1719. The first edition credited the work's protagonist Robinson Crusoe as its author, leading many readers to believe he was a real person and the book a travelogue of true incidents.Epistolary, confessional, and didactic in form, the book is presented as an autobiography of the title character (whose birth name is Robinson Kreutznaer)-a castaway who spends 28 years on a remote tropical desert island near Trinidad, encountering cannibals, captives, and mutineers, before ultimately being rescued. The story has been thought to be based on the life of Alexander Selkirk, a Scottish castaway who lived for four years on a Pacific island called ""Más a Tierra"", now part of Chile, which was renamed Robinson Crusoe Island in 1966",2020,0.14481897627965043,0.9199999999999982,4,4,4,4,10
Harry Potter and the Deathly Hallows - Slytherin Edition,J. K. Rowling,Bloomsbury Children's Books,fiction,Juvenile Fiction,NOT_MATURE,640,0.0,0,2021-06-10,,2021,0.26133999167707034,0.9333333333333336,4,11,4,11,10
The Quick and the Dead,Joy Williams,Knopf,fiction,Fiction,NOT_MATURE,330,0.0,0,2000-01-01,"From one of our most heralded writers--Joy Williams belongs, James Salter has written, ""in the company of Celine, Flannery O'Connor, and Margaret Atwood""--her first novel in more than a decade: the life-and-death adventures of three misfit teenagers in the American desert. Alice, Corvus, and Annabel, each a motherless child, are an unlikely circle of friends. One filled with convictions, another with loss, the third with a worldly pragmatism, they traverse an air-conditioned landscape eccentric with signs and portents--from the preservation of the living dead in a nursing home to the presentation of the dead as living in a wildlife museum--accompanied by restless, confounded adults. A father lusts after his handsome gardener even as he's haunted (literally) by his dead wife; a heartbroken dog runs afoul of an angry neighbor; a young stroke victim drifts westward, his luck running from worse to awful; a sickly musician for whom Alice develops an attraction is drawn instead toward darker imaginings and solutions; and an aging big-game hunter finds spiritual renewal through his infatuation with an eight-year-old--the formidable Emily Bliss Pickless. With nature thoroughly routed and the ambiguities of existence on full display, life and death continue in directions both invisible and apparent. Gloriously funny and wonderfully serious, The Quick and the Dead limns the vagaries of love, the thirst for meaning, and the peculiar paths by which all creatures are led to their destiny. A panorama of contemporary life and an endlessly surprising tour de force: penetrating and magical, ominous and comic, this is the most astonishing book yet in Joy Williams's illustrious career.",2000,0.132334581772784,0.6533333333333324,10,11,11,11,9
White Fang,Jack London,Unknown,fiction,Fiction,NOT_MATURE,336,0.0,0,2007-09-01,"Jack London was an author author best known today for his thrilling adventure books. The fast-paced action of ""White Fang"" never lets up; danger is always waiting beyond the next pile of snow or beneath the claws of a snarling predator. This novel was an immediate success when it was first published in 1905, and it has been so ever since.",2007,0.1348314606741573,0.7466666666666661,10,11,11,11,9
The Adventures of Huckleberry Finn (Illustrated),Mark Twain,Unknown,fiction,Unknown,NOT_MATURE,385,0.0,0,2021-09-08,"The Adventures of Huckleberry Finn (or, in more recent editions, The Adventures of Huckleberry Finn) is a novel by Mark Twain, first published in the United Kingdom in December 1884 and in the United States in February 1885. Commonly named among the Great American Novels, the work is among the first in major American literature to be written throughout in vernacular English, characterized by local color regionalism. It is told in the first person by Huckleberry ""Huck"" Finn, the narrator of two other Twain novels (Tom Sawyer Abroad and Tom Sawyer, Detective) and a friend of Tom Sawyer. It is a direct sequel to The Adventures of Tom Sawyer.",2021,0.15522263836870578,0.9333333333333336,4,4,4,4,10
"The Dragon Blood Collection, Books 1-3",Lindsay Buroker,Lindsay Buroker,fiction,Fiction,NOT_MATURE,829,5.0,1,2014-12-01,"A thousand years have passed since a dragon has been seen in the world. Science and technology have replaced magic, which has dwindled until it has become little more than an element of myth and legend. There are those who still have dragon blood flowing through their veins, distant descendants of the mighty creatures of old. These rare humans have the power to cast magic, the power to heal, and the power to craft alchemical weapons capable of starting wars… or ending them. But they are feared for those powers, and in recent centuries, they have been hunted nearly to extinction. The few remaining survivors must find a way to change how humanity perceives them or be lost to the world forever. The Dragon Blood Collection includes three full-length novels of action, magic, and romance: Balanced on the Blade’s Edge Deathmaker Blood Charged",2014,0.33999167707032873,0.8399999999999999,10,11,11,11,9
